<?xml version="1.0"?>
<xs:schema xmlns:xs="http://www.w3.org/2001/XMLSchema" targetNamespace="https://www.backpack.dero.by/">
    <xs:element name="backpack">
        <xs:complexType>
            <xs:sequence>
                <xs:element name="shape" maxOccurs="unbounded">
                    <xs:complexType>
                        <xs:sequence>
                            <xs:element name="attribute">
                                <xs:complexType>
                                    <xs:attribute name="name" type="xs:string" use="required"/>
                                    <xs:attribute name="value" type="xs:int" use="required">
                                        <xs:simpleType>
                                            <xs:restriction base="xs:int">
                                                <xs:minInclusive value="1"/>
                                                <xs:maxInclusive value="10000"/>
                                            </xs:restriction>
                                        </xs:simpleType>
                                    </xs:attribute>
                                </xs:complexType>
                            </xs:element>
                        </xs:sequence>
                        <xs:attribute name="type" type="xs:string" use="required">
                            <xs:simpleType>
                                <xs:restriction base="xs:string">
                                    <xs:enumeration value="Cube"/>
                                    <xs:enumeration value="Sphere"/>
                                    <xs:enumeration value="Parallelepiped"/>
                                </xs:restriction>
                            </xs:simpleType>
                        </xs:attribute>
                    </xs:complexType>
                </xs:element>
            </xs:sequence>
            <xs:attribute name="size" type="xs:int"/>
        </xs:complexType>
    </xs:element>
</xs:schema>
